{
  "schema_version": "1.0",
  "status": "FROZEN",
  "version": "1.0.0",
  "frozen_at": "2026-08-01",
  "governance": {
    "selection_rule": "EXACTLY_ONE",
    "ai_generation_allowed": false,
    "editor_override_allowed": true,
    "change_policy": "VERSIONED_MIGRATION_ONLY"
  },
  "categories": [
    "Constitutional Law",
    "Criminal Law",
    "Civil Law",
    "Property Law",
    "Family Law",
    "Labour Law",
    "Tax Law",
    "Consumer Law",
    "Commercial Law",
    "Administrative Law",
    "Arbitration",
    "Public Interest Litigation",
    "Government Orders",
    "Legal Procedure",
    "Other"
  ]
}
